{
  "schema_version": 1,
  "evidence_id": "HUEY-EV-6bc42546-3001-420f-a005-c772273ad2f7",
  "certificate_version": 1,
  "classification": "PRIVATE_SENSITIVE",
  "public_title": "Privately retained source; substantive review pending",
  "evidence_type": "document",
  "displayed_dates": [],
  "custody": {
    "raw_custody": "private_repository",
    "public_raw_path": null,
    "public_derivative_paths": []
  },
  "integrity": {
    "mode": "private_salted_commitment",
    "raw_sha256": null,
    "commitment_scheme": "sha256-salted-v1",
    "public_commitment": "3db97deccb4f84fe340b852bd60d9402af9ba10b12df46b6efdb5ca1be114e7c",
    "mime_type": "application/pdf",
    "page_frame_row_count": 1
  },
  "transcription": {
    "status": "machine_typed_visual_checked",
    "public": false,
    "method": [
      "Complete private transcription retained with version history; recorded machine visual comparison; human review pending."
    ],
    "path": null,
    "sha256_or_commitment": null,
    "complete": true
  },
  "description": {
    "public": false,
    "path": null,
    "status": "withheld"
  },
  "relationships": [],
  "review": {
    "machine": "Private package integrity and recorded whole-object inspection checked; selected derivative wording and privacy reviewed by assistants. Human editorial review and source authentication remain pending.",
    "human": null,
    "source_authenticated": false,
    "public_disclosure_reviewed": true
  },
  "limits": [
    "Raw original, complete transcription and description remain private.",
    "Source identity, content truth and human editorial review are not established by this certificate.",
    "The bounded derivative and its omissions do not represent the complete record; copies are not independent corroboration."
  ],
  "status": "active",
  "intake_date_utc": "2026-09-27T04:56:25.186209Z",
  "public_exposure_basis": "UNKNOWN"
}
