{
  "schema_version": 1,
  "evidence_id": "HUEY-EV-2f86310b-400e-451a-b3b9-fdb860655402",
  "certificate_version": 1,
  "classification": "PRIVATE_RAW_PUBLIC_DERIVATIVE",
  "public_title": "Privately retained source with analytical context",
  "evidence_type": "document",
  "displayed_dates": [],
  "custody": {
    "raw_custody": "private_repository",
    "public_raw_path": null,
    "public_derivative_paths": [
      "evidence/derivatives/HUEY-EV-2f86310b-400e-451a-b3b9-fdb860655402/public-v1.md"
    ]
  },
  "integrity": {
    "mode": "private_salted_commitment",
    "raw_sha256": null,
    "commitment_scheme": "sha256-salted-v1",
    "public_commitment": "a1c76d6049f0ecdef252bd565c0d6b06e292eb68a69e5ac4fd3f5d810e81639a",
    "mime_type": "application/pdf",
    "page_frame_row_count": 14
  },
  "transcription": {
    "status": "machine_typed_visual_checked",
    "public": false,
    "method": [
      "Complete private transcription retained with version history; recorded machine visual comparison; human review pending."
    ],
    "path": null,
    "sha256_or_commitment": null,
    "complete": true
  },
  "description": {
    "public": false,
    "path": null,
    "status": "withheld"
  },
  "relationships": [
    {
      "target": "HUEY-EV-5e096ff4-798d-40b4-b333-62b3999349b6",
      "locator": "complete object; all rendered pages; analytical card ha_321066f5-d9a6-4496-bae3-c03c579fe025",
      "relationship": "same_source_family",
      "contribution": "Observed: The other received PDF is the earlier byte prefix. Its rendered pages match the corresponding visible pages, but it lacks that later annotation object. Joint comparison: Preserves the distinction between the earlier PDF and its incremental update.",
      "does_not_establish": "Who edited it, why, authenticity or independent corroboration."
    },
    {
      "target": "SOC-C005",
      "locator": "complete object; all rendered pages; analytical card ha_321066f5-d9a6-4496-bae3-c03c579fe025",
      "relationship": "limits",
      "contribution": "Observed: The other received PDF is the earlier byte prefix. Its rendered pages match the corresponding visible pages, but it lacks that later annotation object. Joint comparison: Prevents repeated representations from being counted as independent observations.",
      "does_not_establish": "Source truth or the completeness of the upstream record."
    }
  ],
  "review": {
    "machine": "Private package integrity and recorded whole-object inspection checked; selected derivative wording and privacy reviewed by assistants. Human editorial review and source authentication remain pending.",
    "human": null,
    "source_authenticated": false,
    "public_disclosure_reviewed": true
  },
  "limits": [
    "Raw original, complete transcription and description remain private.",
    "Source identity, content truth and human editorial review are not established by this certificate.",
    "The bounded derivative and its omissions do not represent the complete record; copies are not independent corroboration."
  ],
  "status": "active",
  "intake_date_utc": "2026-09-27T05:07:50.363195Z",
  "public_exposure_basis": "UNKNOWN"
}
