{
  "schema_version": 1,
  "evidence_id": "HUEY-EV-98a522c3-6a95-4d0a-9380-a7255595829f",
  "certificate_version": 1,
  "classification": "PRIVATE_SENSITIVE",
  "public_title": "Privately retained source; substantive review pending",
  "evidence_type": "document",
  "displayed_dates": [],
  "custody": {
    "raw_custody": "private_repository",
    "public_raw_path": null,
    "public_derivative_paths": []
  },
  "integrity": {
    "mode": "private_salted_commitment",
    "raw_sha256": null,
    "commitment_scheme": "sha256-salted-v1",
    "public_commitment": "7ce289bf08f92533c4de77efa517b3915ce9fdb39fdd7da37c7bd057ecbcecb9",
    "mime_type": "application/pdf",
    "page_frame_row_count": 1
  },
  "transcription": {
    "status": "machine_typed_unreviewed",
    "public": false,
    "method": [
      "Complete private transcription retained; matching prior machine-assisted review reused according to private provenance record; no new human transcription verification asserted."
    ],
    "path": null,
    "sha256_or_commitment": null,
    "complete": true
  },
  "description": {
    "public": false,
    "path": null,
    "status": "withheld"
  },
  "relationships": [],
  "review": {
    "machine": "Private package integrity and recorded whole-object inspection checked; selected derivative wording and privacy reviewed by assistants. Human editorial review and source authentication remain pending.",
    "human": null,
    "source_authenticated": false,
    "public_disclosure_reviewed": true
  },
  "limits": [
    "Raw original, complete transcription and description remain private.",
    "Source identity, content truth and human editorial review are not established by this certificate.",
    "The bounded derivative and its omissions do not represent the complete record; copies are not independent corroboration."
  ],
  "status": "active",
  "intake_date_utc": "2026-09-27T05:07:51.477847Z",
  "public_exposure_basis": "UNKNOWN"
}
