{
  "schema_version": 1,
  "evidence_id": "HUEY-EV-5e096ff4-798d-40b4-b333-62b3999349b6",
  "certificate_version": 1,
  "classification": "PRIVATE_RAW_PUBLIC_DERIVATIVE",
  "public_title": "Privately retained source with analytical context",
  "evidence_type": "document",
  "displayed_dates": [],
  "custody": {
    "raw_custody": "private_repository",
    "public_raw_path": null,
    "public_derivative_paths": [
      "evidence/derivatives/HUEY-EV-5e096ff4-798d-40b4-b333-62b3999349b6/public-v1.md"
    ]
  },
  "integrity": {
    "mode": "private_salted_commitment",
    "raw_sha256": null,
    "commitment_scheme": "sha256-salted-v1",
    "public_commitment": "feb087d1ad519a044630052ee442d02315b06359b5d9562b2d2a36144b9765b2",
    "mime_type": "application/pdf",
    "page_frame_row_count": 14
  },
  "transcription": {
    "status": "machine_typed_visual_checked",
    "public": false,
    "method": [
      "Complete private transcription retained with version history; recorded machine visual comparison; human review pending."
    ],
    "path": null,
    "sha256_or_commitment": null,
    "complete": true
  },
  "description": {
    "public": false,
    "path": null,
    "status": "withheld"
  },
  "relationships": [
    {
      "target": "SOC-C009",
      "locator": "pp6–9; analytical card ha_e6f6ac3a-84a2-4a98-852c-a7d0b9002969",
      "relationship": "limits",
      "contribution": "Source states: A scanned representation contains the overlapping examination note, including its eye-examination and neurological-examination statements. Joint comparison: Identifies specific available and missing documentation.",
      "does_not_establish": "Performance or nonperformance of an unmentioned procedure; clinical adequacy or liability."
    },
    {
      "target": "SOC-C005",
      "locator": "complete object; p9 annotation; analytical card ha_321066f5-d9a6-4496-bae3-c03c579fe025",
      "relationship": "limits",
      "contribution": "Observed: The received scan contains an incremental annotation update. Joint comparison: Prevents repeated representations from being counted as independent observations.",
      "does_not_establish": "Source truth or the completeness of the upstream record."
    }
  ],
  "review": {
    "machine": "Private package integrity and recorded whole-object inspection checked; selected derivative wording and privacy reviewed by assistants. Human editorial review and source authentication remain pending.",
    "human": null,
    "source_authenticated": false,
    "public_disclosure_reviewed": true
  },
  "limits": [
    "Raw original, complete transcription and description remain private.",
    "Source identity, content truth and human editorial review are not established by this certificate.",
    "The bounded derivative and its omissions do not represent the complete record; copies are not independent corroboration."
  ],
  "status": "active",
  "intake_date_utc": "2026-09-27T04:56:18.168541Z",
  "public_exposure_basis": "UNKNOWN"
}
